,property_url,property_id,listing_id,mls,mls_id,status,text,style,full_street_line,street,unit,city,state,zip_code,beds,full_baths,half_baths,sqft,year_built,days_on_mls,list_price,list_date,sold_price,assessed_value,estimated_value,new_construction,lot_sqft,price_per_sqft,latitude,longitude,neighborhoods,county,fips_code,stories,hoa_fee,parking_garage,nearby_schools,dist_to_cwru_mi,price_per_sqft_ann
0,https://www.realtor.com/rentals/details/3818-John-Ave_Cleveland_OH_44113_M97844-16758,9784416758,2973279857,NEOH,5075465,FOR_RENT,"Available December in the HEART of Ohio City! Located at the corner of John and Woodbine, youll find easy access to all the restaurants, bars, and markets the area has to offer. This spacious two bedroom unit has been completely updated from top to bottom. Both bedrooms have new lighted ceiling fans, fresh carpet, and ample closet space. The full bathroom is newly tiled and features a fresh vanity and sink. Living area features high ceilings, recessed lighting, room to relax, and a conveniently located half bath. Kitchen is complete with a full set of stainless steel appliances, new butcher block countertops, and plenty of cabinets. Washer/dryer in private basement and access to partially fenced in yard! Pet friendly with some restrictions. Ample street parking! Contact agent with further questions!",MULTI_FAMILY,3818 John Ave,3818 John Ave,,Cleveland,OH,44113,2.0,1.0,1.0,938.0,1900.0,0,1600.0,2024-10-04,,,355000.0,False,,2.0,41.484055,-81.714165,Ohio City,Cuyahoga,39035.0,,0.0,,"Cleveland Metropolitan School District, Frederick Douglass Reclamation Academy, Near West Intergenerational School",5.662859849002053,20.46908315565032
1,https://www.realtor.com/rentals/details/17205-Lipton-Ave_Cleveland_OH_44128_M45119-59785,4511959785,2973287722,NEOH,5075529,FOR_RENT,"17205 Lipton Ave, Cleveland - Spacious 3 bed 1.5 bath single family home! // $ 1195 rent / $ 1195 deposit // $49 application fee per adult // 1-2 pets OK in this unit. After application pre-approval, a PetScreening is required for any animals to proceed with one of our properties; a PetScreening affidavit is still required if you have no pets. (Some breed restrictions apply per HUD guidelines). // NO SMOKING // 1 time $149 non-refundable set up fee paid at lease signing // $30/month required resident benefit package; can include personal property/liability insurance for an additional $5/month for $35/month total // After application Pre-Approval 1 applicant per household application is required to fill out a PetScreening application, before being about to proceed with placing a Reservation Fee for one of our properties. You will receive a pre-approval for your application and in order to proceed, the PetScreening is required. Even if you have NO pets - this application must be filled out. One time, non-refundable pet fee of $200-500 per animal applies to all pets & must be paid before or when you pay your first month rent. (No fee for qualified assistance animals). // Our application is processed through secure site: Findigs, and they require ID and income verification. Without this, your application will not be processed. They offer 24/7 chat support on their application directly if you have any questions. // BEDROOMS: 3 // BATHROOMS: 1.5 // APPLIANCES PROVIDED: Fridge, stove, microwave, and dishwasher // UTILITIES / RESIDENT RESPONSIBILITY: Residents are responsible for all utilities including: water/sewer/trash, gas & electric and are responsible to maintain lawn care, maintenance & snow removal. // Serious inquiries only.",SINGLE_FAMILY,17205 Lipton Ave,17205 Lipton Ave,,Cleveland,OH,44128,3.0,1.0,1.0,918.0,1959.0,0,1195.0,2024-10-04,135000.0,12610.0,100000.0,False,4312.0,1.0,41.4358,-81.559193,Lee - Miles,Cuyahoga,39035.0,1.0,0.0,2.0,"Cleveland Metropolitan School District, T2 Honors Academy",5.373153333796953,15.620915032679738
2,https://www.realtor.com/rentals/details/1079-E-171st-St-1_Cleveland_OH_44119_M94815-43019,9481543019,2973283498,NEOH,5075502,FOR_RENT,"1079 E 171ST ST| UNIT 1, Cleveland- Spacious 2 bed 1 bath multi-family home! // $ 900 rent / $ 900 deposit // $49 application fee per adult // 1-2 pets OK in this unit. After application pre-approval, a PetScreening is required for any animals to proceed with one of our properties; a PetScreening affidavit is still required if you have no pets. (Some breed restrictions apply per HUD guidelines). // NO SMOKING // 1 time $129 non-refundable set up fee paid at lease signing // $30/month required resident benefit package; can include personal property/liability insurance for an additional $5/month for $35/month total. // After application Pre-Approval 1 applicant per household application is required to fill out a PetScreening application, before being about to proceed with placing a Reservation Fee for one of our properties. You will receive a pre-approval for your application and in order to proceed, the PetScreening is required. Even if you have NO pets - this application must be filled out. One time, non-refundable pet fee of $200-500 per animal applies to all pets & must be paid before or when you pay your first month rent. (No fee for qualified assistance animals). // Our application is processed through secure site: Findigs, and they require ID and income verification. Without this, your application will not be processed. They offer 24/7 chat support on their application directly if you have any questions. // BEDROOMS: 2 // BATHROOMS: 1 // APPLIANCES PROVIDED: A stove will be provided upon move-in // UTILITIES / RESIDENT RESPONSIBILITY: Resident pays gas, water and electric and is responsible for snow removal. // Serious inquiries only.",MULTI_FAMILY,1079 E 171st St Unit 1,1079 E 171st St,Unit 1,Cleveland,OH,44119,2.0,1.0,,1113.0,1920.0,0,900.0,2024-10-04,,,,False,,1.0,41.578304,-81.560318,North Collinwood,Cuyahoga,39035.0,2.0,0.0,1.0,"Lakeshore Intergenerational School, Cleveland Metropolitan School District",5.683166334949567,9.703504043126685
3,https://www.realtor.com/rentals/details/787-London-Rd-Apt-3_Cleveland_OH_44110_M98336-05896,9833605896,2973268476,AVAL,61200520,FOR_RENT,"Amazing 1 bedroom, 1 bathroom apartment in Cleveland. Amenities included: hardwood floors, updated kitchen, and updated bathroom. Utilities included: water. Is not pet friendly. Date Available: Oct 1st 2024. $700/month rent. $700 security deposit required. Please submit the form on this page or contact Jamilla to learn more. This property is managed by a responsible landlord using Avail landlord software.",APARTMENT,787 London Rd Apt 3,787 London Rd,Apt 3,Cleveland,OH,44110,1.0,1.0,,700.0,,0,700.0,2024-10-04,,,,False,,1.0,41.559353,-81.565918,South Collinwood,Cuyahoga,39035.0,,,,"Cleveland Metropolitan School District, East Academy School District",4.391805843585582,12.0
4,https://www.realtor.com/rentals/details/1434-W-112th-St-Apt-2_Cleveland_OH_44102_M91901-05426,9190105426,2973256778,RENU,r3773772,FOR_RENT,"Welcome to this charming apartment located at 1434 West 112th Street in Cleveland, OH. Unit #2 offers 900.0 sqft of living space in a historic building built in 1907. This cozy apartment features 2 bedrooms and 1 bathroom, providing a comfortable living environment.The unit is well-maintained and boasts the beautiful original hard wood floors. The living area is spacious and ideal for relaxing or entertaining guests.Located in a convenient neighborhood, this apartment offers easy access to local amenities, dining options, and public transportation. With a 12-month lease starting on October 20, 2024, this property provides a great opportunity for those looking for a long-term rental option.Don't miss the chance to make this apartment your new home. Schedule a viewing today and experience the comfort and convenience this property has to offer.",APARTMENT,1434 W 112th St Apt 2,1434 W 112th St,Apt 2,Cleveland,OH,44102,2.0,1.0,,900.0,,0,1100.0,2024-10-04,,,,False,,1.0,41.481632,-81.765244,Edgewater,Cuyahoga,39035.0,,,,"Lakewood City Academy, Cleveland Metropolitan School District, Hope Academy Northwest Campus, Lake Erie International High School School District",8.287265398175421,14.666666666666666
7,https://www.realtor.com/rentals/details/14216-Ashwood-Rd_Cleveland_OH_44120_M37441-95467,3744195467,2973234363,NEOH,5075224,FOR_RENT,"Take a look at this newly updated colonial home in the heart of Shaker Heights! This property features 3 beds and 1 1/2 baths! Both bedrooms are located on the second floor of this home. There is an additional bonus room on the first floor that could be used as a 3rd bedroom or back patio room! Updates to this property include new flooring, new interior paint, updated main bathroom and much more! Schedule your showing!",SINGLE_FAMILY,14216 Ashwood Rd,14216 Ashwood Rd,,Cleveland,OH,44120,3.0,1.0,1.0,1459.0,1929.0,0,1700.0,2024-10-04,140000.0,55800.0,201200.0,False,6987.0,1.0,41.471949,-81.582492,"Ludlow, Buckeye - Shaker",Cuyahoga,39035.0,2.0,0.0,2.0,"Randall Park High School, Shaker Heights City School District, Chapelside Cleveland Academy School District, Wings Academy 2",2.6061280879340107,13.982179575051404
8,https://www.realtor.com/rentals/details/3368-W-105th-St_Cleveland_OH_44111_M36581-93894,3658193894,2973226476,TRBO,1618178,FOR_RENT,"Two bedroom townhome style duplex. Completely remodeled throughout. Kitchen, new flooring's, updated bathroom, private basement and walk up attic. All brand new all appliances including washer and dryer, new windows. Huge shared yard. Off street parking, one side of garage included. To apply, visit TurboTenant and search for Property ID 1618178",TOWNHOMES,3368 W 105th St,3368 W 105th St,,Cleveland,OH,44111,2.0,1.0,1.0,1175.0,,1,1240.0,2024-10-03,93000.0,31330.0,136606.0,False,,1.0,41.460826,-81.759247,West Boulevard,Cuyahoga,39035.0,,,,"Cleveland Metropolitan School District, Constellation Schools: Outreach Academy For Students With Di",8.38358119820807,12.663829787234043
9,https://www.realtor.com/rentals/details/10809-Nelson-Ave_Cleveland_OH_44105_M91154-09583,9115409583,2973225962,NEOH,5075194,FOR_RENT,Newly renovated three bedroom apartment. Beautiful kitchen and bath!!!,APARTMENT,10809 Nelson Ave,10809 Nelson Ave,,Cleveland,OH,44105,3.0,1.0,,960.0,1920.0,1,950.0,2024-10-03,,,,False,5602.0,1.0,41.453377,-81.60923,Union - Miles Park,Cuyahoga,39035.0,2.0,,,"Harvard Avenue Community School, Cleveland Metropolitan School District",3.5145344299841255,11.875
11,https://www.realtor.com/rentals/details/7905-Berry-Ave_Cleveland_OH_44102_M30293-69787,3029369787,2973220969,NEOH,5075149,FOR_RENT,"7905 Berry Ave, Cleveland - Spacious 4 bed 1.5 bath single family home! // $ 1445 rent / $ 1445 deposit // $49 application fee per adult // 1-2 pets OK in this unit. After application pre-approval, a PetScreening is required for any animals to proceed with one of our properties; a PetScreening affidavit is still required if you have no pets. (Some breed restrictions apply per HUD guidelines). // NO SMOKING // 1 time $149 non-refundable set up fee paid at lease signing // $30/month required resident benefit package; can include personal property/liability insurance for an additional $5/month for $35/month total // After application Pre-Approval 1 applicant per household application is required to fill out a PetScreening application, before being about to proceed with placing a Reservation Fee for one of our properties. You will receive a pre-approval for your application and in order to proceed, the PetScreening is required. Even if you have NO pets - this application must be filled out. One time, non-refundable pet fee of $200-500 per animal applies to all pets & must be paid before or when you pay your first month rent. (No fee for qualified assistance animals). // Our application is processed through secure site: Findigs, and they require ID and income verification. Without this, your application will not be processed. They offer 24/7 chat support on their application directly if you have any questions. // BEDROOMS: 4 // BATHROOMS: 1.5 // APPLIANCES PROVIDED: Fridge, stove and microwave // UTILITIES / RESIDENT RESPONSIBILITY: Residents are responsible for all utilities including: water/sewer/trash, gas & electric and are responsible to maintain lawn care, maintenance & snow removal. // Serious inquiries only.",SINGLE_FAMILY,7905 Berry Ave,7905 Berry Ave,,Cleveland,OH,44102,4.0,1.0,1.0,1932.0,1904.0,1,1445.0,2024-10-03,88000.0,19400.0,98507.0,False,5140.0,1.0,41.463662,-81.740335,West Boulevard,Cuyahoga,39035.0,2.0,0.0,2.0,"Cleveland Metropolitan School District, Constellation Schools: Outreach Academy For Students With Di",7.398863336188359,8.975155279503106
13,https://www.realtor.com/rentals/details/4388-W-47th-St_Cleveland_OH_44144_M30011-46690,3001146690,2973224900,NEOH,5075174,FOR_RENT,"4388 W 47TH ST | UP, Cleveland- Spacious 2 bed 1 bath multi-family home! // $ 1200 rent / $ 1200 deposit // $49 application fee per adult // 1-2 pets OK in this unit. After application pre-approval, a PetScreening is required for any animals to proceed with one of our properties; a PetScreening affidavit is still required if you have no pets. (Some breed restrictions apply per HUD guidelines). // NO SMOKING // 1 time $149 non-refundable set up fee paid at lease signing // $30/month required resident benefit package; can include personal property/liability insurance for an additional $5/month for $35/month total. // CMHA OK - 2 bdrm voucher; must be prepared with reservation fee to hold the property and moving packet. // After application Pre-Approval 1 applicant per household application is required to fill out a PetScreening application, before being about to proceed with placing a Reservation Fee for one of our properties. You will receive a pre-approval for your application and in order to proceed, the PetScreening is required. Even if you have NO pets - this application must be filled out. One time, non-refundable pet fee of $200-500 per animal applies to all pets & must be paid before or when you pay your first month rent. (No fee for qualified assistance animals). // Our application is processed through secure site: Findigs, and they require ID and income verification. Without this, your application will not be processed. They offer 24/7 chat support on their application directly if you have any questions. // BEDROOMS: 2 // BATHROOMS: 1 // APPLIANCES PROVIDED: Stove // UTILITIES / RESIDENT RESPONSIBILITY: Resident pays gas and electric and is responsible for snow removal. // Serious inquiries only.",MULTI_FAMILY,4388 W 47th St Unit 2 /Up,4388 W 47th St,Unit 2 /Up,Cleveland,OH,44144,2.0,1.0,,1019.0,1924.0,1,1200.0,2024-10-03,73000.0,31580.0,165900.0,False,,1.0,41.436968,-81.718189,Old Brooklyn,Cuyahoga,39035.0,2.0,0.0,1.0,"Cleveland Metropolitan School District, Constellation Schools: Old Brooklyn Community Middle",7.35297572732548,14.131501472031402
14,https://www.realtor.com/rentals/details/3188-W-14th-St-Apt-3_Cleveland_OH_44109_M96227-70458,9622770458,2973226416,TRBO,484979,FOR_RENT,"Tremont/Downtown/Steelyard 3188 West 14th St, unit 3, Cleveland, OH 44109 NO EVICTIONS NO FELONIES NO DOGS NO CRIMINAL ACTIVITY NO SECTION 8 Please contact us regarding this unit ONLY if you are interested in occupancy March 1 or sooner. Third floor. triplex house. 1000 square ft. 2bd, 1 ba. Two large bedrooms with large, lighted semi walk-in closets. Lighted storage closet in living room. New stainless Samsung French door fridge and dishwasher, stainless over-stove microwave, stainless gas stove with griddle, disposal, All new vinyl windows and blinds 220 baseboard heat. Laundry hookups under counter behind curtain for all in one 110v unit. Off-street parking for 2 cars included in rent. We allow cats with a pet deposit in the amount of one month's rent. This is in addition to your regular deposit and is fully refundable with interest upon move-out. Water and sewer submeters installed so you only pay for what you use. Tenant pays gas heat & elec, water/sewer. Two year lease. To apply, visit TurboTenant and search for Property ID 484979",CONDOS,3188 W 14th St Apt 3,3188 W 14th St,Apt 3,Cleveland,OH,44109,2.0,1.0,,1000.0,1892.0,1,1195.0,2024-10-03,,,,False,,1.0,41.467541,-81.691643,Tremont,Cuyahoga,39035.0,,,,Cleveland Metropolitan School District,5.009554533195886,14.34
16,https://www.realtor.com/rentals/details/2413-Tate-Ave_Cleveland_OH_44109_M30533-90392,3053390392,2973255283,NEOH,5075254,FOR_RENT,"JUST ABOUT FINISHED! Come take a look at this spacious 3 bedroom 1 bath home waiting for you today! Whether you are looking to buy or rent, this property is for you! This home is 85% complete being renovated from head to toe. Renovations will be done in under two weeks. Features of this property include new windows, 2 spacious bedrooms on the first floor, tons of natural lighting throughout the entire house and a massive 3rd floor bedroom! The basement is partially finished with a mini bar area in it. This property also highlights a 2 car detached garage, driveway and street parking. Located within close proximity to restaurants, shopping centers, and minutes away from downtown Cleveland! Don't miss this opportunity today! Schedule your showing!",SINGLE_FAMILY,2413 Tate Ave,2413 Tate Ave,,Cleveland,OH,44109,3.0,1.0,,1158.0,1923.0,0,1600.0,2024-10-04,25000.0,24540.0,104000.0,False,4482.0,1.0,41.434607,-81.699844,Old Brooklyn,Cuyahoga,39035.0,,0.0,2.0,Cleveland Metropolitan School District,6.757360782769328,16.580310880829014
17,https://www.realtor.com/rentals/details/2214-E-89th-St-1_Cleveland_OH_44106_M91492-98429,9149298429,2973220334,NEOH,5074993,FOR_RENT,"Unique newly constructed multi-family 3-story apartment building, 4 one-bedroom units on the first floor. Features include large bedroom(s), floor-to-ceiling windows, and walk-in closets. The kitchen features and appliances: dishwasher, garbage disposal, oven/range, refrigerator, microwave and an eat-in kitchen. Other highlights: High speed internet access, washer/dryer, security system, wheelchair accessible (rooms). Available Units: #1 (559 sf) $1, 225.00; #3 (523 sf) $1, 200.00; #5 (523 sf) $1, 200.00; #7 (547 sf) $1, 225.00",APARTMENT,2214 E 89th St Unit 1,2214 E 89th St,Unit 1,Cleveland,OH,44106,1.0,1.0,,559.0,2024.0,1,1225.0,2024-10-03,,,,True,,2.0,41.497963,-81.62484,Fairfax,Cuyahoga,39035.0,1.0,,,Cleveland Metropolitan School District,0.958509162462623,26.29695885509839
18,https://www.realtor.com/rentals/details/2214-E-89th-St-2_Cleveland_OH_44106_M92254-20124,9225420124,2973219456,NEOH,5075125,FOR_RENT,"Unique newly constructed multi-family 3-story apartment building, 4 two-bedroom units on the 2nd floor with bedrooms located on the 3rd floor. Features include large bedroom(s), floor-to-ceiling windows, and walk-in closets; 1.5 bathrooms. The kitchen features and appliances: dishwasher, garbage disposal, oven/range, refrigerator, microwave and an eat-in kitchen. Other highlights: High speed internet access, washer/dryer, security system, wheelchair accessible (rooms). Available Units: #2 (1, 245 sf) $1, 850.00; #4 (1, 120 sf) $1, 800.00; #6 (1, 120 sf) $1, 800.00; #8 (1, 239 sf) $1, 850.00.",APARTMENT,2214 E 89th St Unit 2,2214 E 89th St,Unit 2,Cleveland,OH,44106,2.0,1.0,1.0,1245.0,2024.0,1,1850.0,2024-10-03,,,,True,,1.0,41.497963,-81.62484,Fairfax,Cuyahoga,39035.0,,,,Cleveland Metropolitan School District,0.958509162462623,17.83132530120482
19,https://www.realtor.com/rentals/details/4195-W-22nd-St_Cleveland_OH_44109_M43053-92924,4305392924,2973226846,NEOH,5075189,FOR_RENT,"4195 W 22ND ST | DN, Cleveland- Spacious 2 bed 1 bath multi-family home! // $ 900 rent / $ 900 deposit // $49 application fee per adult // 1-2 pets OK in this unit. After application pre-approval, a PetScreening is required for any animals to proceed with one of our properties; a PetScreening affidavit is still required if you have no pets. (Some breed restrictions apply per HUD guidelines). // NO SMOKING // 1 time $129 non-refundable set up fee paid at lease signing // $30/month required resident benefit package; can include personal property/liability insurance for an additional $5/month for $35/month total. // After application Pre-Approval 1 applicant per household application is required to fill out a PetScreening application, before being about to proceed with placing a Reservation Fee for one of our properties. You will receive a pre-approval for your application and in order to proceed, the PetScreening is required. Even if you have NO pets - this application must be filled out. One time, non-refundable pet fee of $200-500 per animal applies to all pets & must be paid before or when you pay your first month rent. (No fee for qualified assistance animals).// Our application is processed through secure site: Findigs, and they require ID and income verification. Without this, your application will not be processed. They offer 24/7 chat support on their application directly if you have any questions. // BEDROOMS: 2 // BATHROOMS: 1 // APPLIANCES PROVIDED: N/A // UTILITIES / RESIDENT RESPONSIBILITY: Resident pays gas and electric and is responsible for snow removal. // Serious inquiries only.",MULTI_FAMILY,4195 W 22nd St Unit 1 /Dn,4195 W 22nd St,Unit 1 /Dn,Cleveland,OH,44109,2.0,1.0,,831.0,1920.0,1,900.0,2024-10-03,78000.0,22720.0,157000.0,False,,1.0,41.441654,-81.698836,Old Brooklyn,Cuyahoga,39035.0,2.0,0.0,1.0,Cleveland Metropolitan School District,6.381541502031111,12.99638989169675
20,https://www.realtor.com/rentals/details/2344-Prospect-Ave-E-Apt-211_Cleveland_OH_44115_M96074-58660,9607458660,2973199229,AVAL,61198867,FOR_RENT,"We are located across the street of the Cleveland State University Campus. 2344 Prospect Ave. You can rent these units FURNISHED or UNFURNISHED. All Utilities are included IN RENT. All you are responsible for is Cable and Internet. Quick access to public transportation, Next to E LINE TROLLEY. Takes you to all downtown attractions. We offer short 3-month leases. Milton Manor Apartments. No appointment is needed. Our office hours are, Mon-Fri 10-4pm. Contact info, Phone: Website: MiltonManor.us Email:",APARTMENT,2344 Prospect Ave E Apt 211,2344 Prospect Ave,Apt 211,Cleveland,OH,44115,1.0,1.0,,600.0,,1,940.0,2024-10-03,,,,False,,2.0,41.500053,-81.672493,"Downtown Cleveland, Campus District, CSU - Euclid Corridor",Cuyahoga,39035.0,,,,"Cleveland Metropolitan School District, Invictus High School School District",3.338061066561084,18.8
22,https://www.realtor.com/rentals/details/19514-Pawnee-Ave_Cleveland_OH_44119_M37751-19381,3775119381,2973208551,NEOH,5074667,FOR_RENT,"Just Updated SFR ready for RENT! 4-bedroom, 2-bathroom 2 Car Garage classic colonial-style single-family home in Cleveland, Ohio. This charming residence features a spacious two-car garage, newer heater, and vinyl windows. Nestled in a prime location, it offers convenient access to nearby attractions, schools, and highways. The property also includes a well-appointed laundry room.",SINGLE_FAMILY,19514 Pawnee Ave,19514 Pawnee Ave,,Cleveland,OH,44119,4.0,2.0,,2570.0,1910.0,1,1450.0,2024-10-03,72000.0,20480.0,114000.0,False,5001.0,1.0,41.588451,-81.54285,North Collinwood,Cuyahoga,39035.0,2.0,0.0,2.0,"Lakeshore Intergenerational School, Cleveland Metropolitan School District, New Day Academy Boarding & Day School",6.728738092260464,6.770428015564202
23,https://www.realtor.com/rentals/details/15815-Parkgrove-Ave_Cleveland_OH_44110_M41047-77578,4104777578,2973202911,NEOH,5075006,FOR_RENT,"15815 Parkgrove Ave | UP, Cleveland- Spacious 2 bed 1 bath multi-family home! // $ 975 rent / $ 975 deposit // $49 application fee per adult // 1-2 pets OK in this unit. After application pre-approval, a PetScreening is required for any animals to proceed with one of our properties; a PetScreening affidavit is still required if you have no pets. (Some breed restrictions apply per HUD guidelines). // NO SMOKING // 1 time $129 non-refundable set up fee paid at lease signing // $30/month required resident benefit package; can include personal property/liability insurance for an additional $5/month for $35/month total. // After application Pre-Approval 1 applicant per household application is required to fill out a PetScreening application, before being about to proceed with placing a Reservation Fee for one of our properties. You will receive a pre-approval for your application and in order to proceed, the PetScreening is required. Even if you have NO pets - this application must be filled out. One time, non-refundable pet fee of $200-500 per animal applies to all pets & must be paid before or when you pay your first month rent. (No fee for qualified assistance animals). // Our application is processed through secure site: Findigs, and they require ID and income verification. Without this, your application will not be processed. They offer 24/7 chat support on their application directly if you have any questions. // BEDROOMS: 2 // BATHROOMS: 1 // APPLIANCES PROVIDED: Fridge // UTILITIES / RESIDENT RESPONSIBILITY: Resident pays gas and electric and is responsible for snow removal. // Serious inquiries only.",MULTI_FAMILY,15815 Parkgrove /Up Ave Unit 2,15815 Parkgrove /Up Ave,Unit 2,Cleveland,OH,44110,2.0,1.0,,780.0,1920.0,1,975.0,2024-10-03,60000.0,19610.0,132557.0,False,,1.0,41.575136,-81.570124,North Collinwood,Cuyahoga,39035.0,2.0,0.0,1.0,Cleveland Metropolitan School District,5.276043526634351,15.0
