,property_url,property_id,listing_id,mls,mls_id,status,text,style,full_street_line,street,unit,city,state,zip_code,beds,full_baths,half_baths,sqft,year_built,days_on_mls,list_price,list_date,sold_price,assessed_value,estimated_value,new_construction,lot_sqft,price_per_sqft,latitude,longitude,neighborhoods,county,fips_code,stories,hoa_fee,parking_garage,nearby_schools,dist_to_cwru_mi,price_per_sqft_ann
276,https://www.realtor.com/rentals/details/3489-Bosworth-Rd-Apt-3_Cleveland_OH_44111_M96714-31754,9671431754,2970646504,REDI,-NPOoZAJhgQiWkEDYD5T$3,FOR_RENT,"Charming 3rd Floor unit of a multi-family home located in the West Boulevard neighborhood in Cleveland, Ohio. Minutes from Lakewood, Ohio City, Tremont, Edgewater Beach, Downtown Cleveland, and Cleveland Hopkins Airport. UNIT DETAILS: - (2) bedrooms, (1) full bathroom - Living/dining room with built-in shelving - Fully updated kitchen with high quality cabinets, quartz countertops and stainless steel appliances - Updated bathroom with tub, toilet, sink and ceramic tile flooring - Beautiful original hardwood floors throughout - All new windows for ample natural light - New light fixtures and new paint throughout - Off-street designated parking space (1) - Approximately 900 sq ft - Additional private storage available in basement - W/D hookups available in basement (additional monthly water fee applies) ABOUT THE AREA: - Plenty of bars and restaurants just minutes away in Lakewood - 5 minutes to: I-90, I-71, Target, Giant Eagle, Aldi, Home Depot, Halloran Park - 10 minutes to: I-480, Walmart, Sam's Club, Whole Foods, Edgewater Park, Lakewood Park RENTAL TERMS: - Available: Sept 1st - Rent = $900 per month - Security Deposit = $900 - Tenant pays electric and gas (Gas is through Dominion, Electric is through First Energy (Illuminating Company). - Landlord pays water, sewer, trash ($35/month water fee applies for W/D hookup) - Pets on a case by case basis and subject to additional fees. - NO smoking - $35 Non Refundable Application Fee (We screen using credit / background / eviction checks as well as income verification and rental history) - This property is NOT approved for Section 8 / Eden / or other rent assistance programs - Leasing Contact: Alejandro Giraldo To Pre-qualify, please complete the following steps: 1. Download the RentRedi App: Get it on Google Play OR Download on the App Store 2. Go to Prequalify in the app 3. Enter your details 4. Search by Unit Code: DFN-862 5. Send it! This property is using RentRedi for rent payments. To prequalify or apply, download the RentRedi app from Google Play or the App Store. You can also visit tenant.rentredi.com/getStarted/apply/DFN862 to apply, or go to tenant.rentredi.com/getStarted/prequalify/DFN862 to prequalify. For applying through the RentRedi mobile app, please follow these steps: Step 1. Tap the Apply button. Step 2. Click the + icon. Step 3. Select whether you're prequalifying or applying. Step 4. Enter in your unit code: DFN-862. Step 5. Click Enter Information and answer the questions. Step 6. Click Send to submit to the landlord. This property is using RentRedi for rent payments. With RentRedi, you can easily submit rent payments, boost your credit by reporting rent payments, sign up for affordable renters insurance, and more from the app!",DUPLEX_TRIPLEX,3489 Bosworth Rd Apt 3,3489 Bosworth Rd,Apt 3,Cleveland,OH,44111,2.0,1.0,,900.0,,53,900.0,2024-08-12,,,,False,,1.0,41.457523,-81.764191,West Boulevard,Cuyahoga,39035.0,,,,"Cleveland Metropolitan School District, Constellation Schools: Outreach Academy For Students With Di",8.705768333788237,12.0
278,https://www.realtor.com/rentals/details/1321-W-85th-St-Apt-1_Cleveland_OH_44102_M99111-28622,9911128622,2970654490,NEOH,5061539,FOR_RENT,"1321 W 85th St Unit 1, Cleveland - Spacious 2 bed 1 bath apartment! // $ 1, 000 rent / $ 1, 000 deposit // $49 application fee per adult // 1-2 pets OK with approved PetScreening and PetFee.(Some breed restrictions apply per HUD guidelines). // NO SMOKING // 1 time $149 non-refundable set up fee paid at lease signing // $30/month required resident benefit package; can include personal property/liability insurance for an additional $5/month for $35/month total. // All applicants are required to fill out a PetScreening application, found on our website directly on the application before being processed. Even if you have NO pets - this application must be filled out. One time, non-refundable pet fee of $200-500 per animal applies to all pets & must be paid prior to or when you pay your first month rent. (No fee for qualified assistance animals). // Our application is processed through secure site: Findigs, and they require ID and income verification. Without this, your application will not be processed. They offer 24/7 chat support on their application directly if you have any questions. // BEDROOMS: 2 // BATHROOMS: 1 // APPLIANCES PROVIDED: Stove and fridge // UTILITIES / RESIDENT RESPONSIBILITY: Resident pays gas/electric and is responsible for snow removal. Lawn care and water/sewer/trash is included. // Serious inquiries only.",APARTMENT,1321 W 85th St Apt 1,1321 W 85th St,Apt 1,Cleveland,OH,44102,2.0,1.0,,946.0,1900.0,53,1000.0,2024-08-12,,,246000.0,False,,1.0,41.48267,-81.742996,Detroit - Shoreway,Cuyahoga,39035.0,2.0,,,"Cleveland Metropolitan School District, Constellation Schools: Madison Community Elementary, Lake Erie International High School School District",7.141569513258406,12.684989429175475
282,https://www.realtor.com/rentals/details/701-W-Lakeside-Ave-Apt-704_Cleveland_OH_44113_M37816-92311,3781692311,2970590860,NEOH,5061081,FOR_RENT,"Seldom available lease opportunity at Pinnacle. The heart of the Warehouse District and all the comforts of a full-service luxury condominium. Large, open floor plan that's as perfect for everyday living as it is for a party. Full walls of floor to ceiling windows with lake views and the peaks of the twinkling skyline at night. Large kitchen with granite counters, stainless appliances, and a big island with a breakfast bar. The master suite has an extra-large walk-in closet and a beautiful bath with double sinks and a roomy shower with glass doors. The second bedroom generously sized, making it perfect as a bedroom, an office, or both, and has its own full bath with a tub. There's an elegant powder room off the entry hall. A large laundry/utility room gives you the convenience of a full-sized washer and dryer and a laundry sink, and also provides some extra storage room. And one of the best places of all is the balcony, where you feel the shoreline and the Stadium - and the skyline - like they're right across the street. And they are! 24-hour concierge, a full gym, sauna, and a beautiful rooftop garden complete the amenities. One garage parking space (a prime space, directly across from the elevator) is included. Multi-year lease also available.",CONDOS,701 W Lakeside Ave Apt 704,701 W Lakeside Ave,Apt 704,Cleveland,OH,44113,2.0,2.0,1.0,1607.0,2005.0,56,2800.0,2024-08-09,331100.0,137350.0,436681.0,False,37592.0,2.0,41.500376,-81.700926,"Downtown Cleveland, Warehouse District",Cuyahoga,39035.0,1.0,,1.0,"Cleveland Metropolitan School District, Near West Intergenerational School",4.807904012584261,20.9085252022402
284,https://www.realtor.com/rentals/details/8800-Meridian-Ave-Down_Cleveland_OH_44106_M92233-19632,9223319632,2970550025,REDI,-NBJluqa88BXSXEH1ZjH$Down,FOR_RENT,"2 bedroom duplex (down unit) in the Hough Neighborhood of Cleveland. 2nd bedroom has an open concept. Opportunity to utilize the space in different ways. 5 minutes from Case Western University and 8 minutes from Cleveland Clinic. Very quiet neighborhood To prequalify or apply, download the RentRedi app from Google Play or the App Store. You can also visit tenant.rentredi.com/getStarted/apply/RVT565 to apply, or go to tenant.rentredi.com/getStarted/prequalify/RVT565 to prequalify. For applying through the RentRedi mobile app, please follow these steps: Step 1. Tap the Apply button. Step 2. Click the + icon. Step 3. Select whether you're prequalifying or applying. Step 4. Enter in your unit code: RVT-565. Step 5. Click Enter Information and answer the questions. Step 6. Click Send to submit to the landlord. This property is using RentRedi for rent payments. With RentRedi, you can easily submit rent payments, boost your credit by reporting rent payments, sign up for affordable renters insurance, and more from the app!",DUPLEX_TRIPLEX,8800 Meridian Ave Unit Down,8800 Meridian Ave,Unit Down,Cleveland,OH,44106,2.0,1.0,,850.0,,56,850.0,2024-08-09,,,,False,,1.0,41.513184,-81.625854,Hough,Cuyahoga,39035.0,,,,Cleveland Metropolitan School District,1.09347784912696,12.0
288,https://www.realtor.com/rentals/details/842-Wayside-Rd-Up_Cleveland_OH_44110_M96324-95680,9632495680,2970515954,INGO,37365,FOR_RENT,VOUCHERS ACCEPTED! Available for rent: 2 bed/1 bath - 1344 square foot. This home features an updated kitchen with nice hardwood flooring. House has been freshly painted with neutral colors. Tenant is responsible for gas and energy. Security deposit equal to 1 month's rent is required. Free application and $45 screening will be necessary for each adult over 18 years of age. Pet Fee: $300 one time Contact info: Keith Luber. Phone: Email:,DUPLEX_TRIPLEX,842 Wayside Rd Unit Up,842 Wayside Rd,Unit Up,Cleveland,OH,44110,2.0,1.0,,1344.0,,57,1000.0,2024-08-08,,,,False,,1.0,41.559513,-81.564125,South Collinwood,Cuyahoga,39035.0,,,,"Cleveland Metropolitan School District, East Academy School District",4.448626536437457,8.928571428571429
289,https://www.realtor.com/rentals/details/2016-W-85th-St_Cleveland_OH_44102_M32078-93767,3207893767,2970524896,NEOH,5060358,FOR_RENT,"Come check out this 4 bedroom beauty! This rental unit is located on the upper level of a duplex and has over 1, 700 square feet of living space! The kitchen has been totally renovated, with new gray cabinets, new countertops and luxury vinyl flooring & a stainless steel stove & refrigerator! There is a 3/4 bath with a stand up shower on the upper level and a full bath on the main living level of this upper unit. The entire space has been freshly painted throughout and features new flooring. The spacious living room has a cozy decorative fireplace. Enjoy the wonderful covered front porch and the convenience of the 1 car garage space located on a corner lot. This unit has easy access to 1-90 and the Detroit Shoreway. Section 8 Accepted. Call for your private showing today!",MULTI_FAMILY,2016 W 85th St Unit Up,2016 W 85th St,Unit Up,Cleveland,OH,44102,4.0,2.0,,1700.0,1904.0,57,1400.0,2024-08-08,55000.0,23000.0,155966.0,False,4617.0,1.0,41.476624,-81.743458,Cudell,Cuyahoga,39035.0,2.0,0.0,1.0,"Cleveland Metropolitan School District, Constellation Schools: Madison Community Elementary, Lake Erie International High School School District",7.263727329170542,9.882352941176471
294,https://www.realtor.com/rentals/details/2044-Random-Rd-Unit-101_Cleveland_OH_44106_M34554-10089,3455410089,2970433648,NEOH,5060024,FOR_RENT,"This two-story unit on the southeast corner of the building enjoys lots of light and features sophisticated kitchen and bath upgrades. From the private patio outside, entry into the unit flows into a living area and a first floor full bedroom and bathroom. Master bedroom suite and an additional bedroom with full bathroom are on the second floor. The kitchen features include a waterfall quartz countertop at the island, all GE appliances, and a beautiful quartz backsplash. Separate pantry closet. Bamboo floors throughout. Second floor laundry provides easy access with plenty of room. Two dedicated parking spaces immediately adjacent to the garage entry door allows for easy access. A wonderfully private unit. Rent or Buy! Fair housing accommodations and modifications for persons with disabilities will be considered on a case by case basis in accordance with the fair housing laws.",CONDOS,2044 Random Rd Unit 101,2044 Random Rd,Unit 101,Cleveland,OH,44106,3.0,3.0,,2133.0,2018.0,59,3250.0,2024-08-06,575000.0,18480.0,673600.0,False,,2.0,41.507403,-81.599543,"University Circle, Little Italy",Cuyahoga,39035.0,2.0,,2.0,"Cleveland Metropolitan School District, Citizens Leadership Academy",0.5069299473166203,18.28410689170183
297,https://www.realtor.com/rentals/details/1372-E-111th-St_Cleveland_OH_44106_M45616-52957,4561652957,2970444338,NEOH,5060149,FOR_RENT,"1372 E 111TH St, Cleveland - Spacious 6 bed 2 bath single family home! // $ 1520 rent / $ 1520 deposit // $49 application fee per adult // 1-2 pets OK with approved PetScreening and PetFee.(Some breed restrictions apply per HUD guidelines). // NO SMOKING // 1 time $169 non-refundable set up fee paid at lease signing // $30/month required resident benefit package; can include personal property/liability insurance for an additional $5/month for $35/month total. // CMHA OKAY WITH 4-5 BEDROOM VOUCHER, MUST HAVE FULL RESERVATION FEE AT TIME OF PLACING DEPOSIT, NO EXCEPTIONS // All applicants are required to fill out a PetScreening application, found on our website directly on the application before being processed. Even if you have NO pets - this application must be filled out. One time, non-refundable pet fee of $200-500 per animal applies to all pets & must be paid prior to or when you pay your first month rent. (No fee for qualified assistance animals). // Our application is processed through secure site: Findigs, and they require ID and income verification. Without this, your application will not be processed. They offer 24/7 chat support on their application directly if you have any questions. // BEDROOMS: 6 // BATHROOMS: 2 // APPLIANCES PROVIDED: Fridge, stove, and dishwasher // UTILITIES / RESIDENT RESPONSIBILITY: Residents are responsible for all utilities including: water/sewer/trash, gas & electric and are responsible to maintain lawn care, maintenance & snow removal. // Serious inquiries only.",SINGLE_FAMILY,1372 E 111th St,1372 E 111th St,,Cleveland,OH,44106,6.0,2.0,,1578.0,1900.0,59,1520.0,2024-08-06,213600.0,6200.0,193174.0,False,4443.0,1.0,41.52033,-81.608652,Glenville,Cuyahoga,39035.0,2.0,0.0,,Cleveland Metropolitan School District,1.1063373474050147,11.55893536121673
312,https://www.realtor.com/rentals/details/12418-Osceola-Ave_Cleveland_OH_44108_M46364-00733,4636400733,2970290611,AVAL,61151519,FOR_RENT,"Welcome to 12418 Osceola Avenue! Located in a quiet neighborhood, this cozy 3-bedroom, 1-bathroom home is ready for you to move in and make your own. Pets are welcome too! There will be a $300 deposit required, as well as a $30 monthly fee for each pet. This 1440 sq ft house is spacious and perfect for a family, or group of friends. It features an inviting living room and a kitchen that is great for your best dishes. The bedrooms are bright and airy with great storage space. Take advantage of this fantastic opportunity to live in a wonderful property that has a solid foundation. You won't be disappointed! Make 12418 Osceola Avenue your next home today, and experience the peace you desire.",SINGLE_FAMILY,12418 Osceola Ave,12418 Osceola Ave,,Cleveland,OH,44108,3.0,1.0,,1440.0,,64,1500.0,2024-08-01,78000.0,8720.0,59300.0,False,,1.0,41.52605,-81.599227,Forest Hills,Cuyahoga,39035.0,,,,"Cleveland Metropolitan School District, Old Brook High School School District",1.5746161833037164,12.5
322,https://www.realtor.com/rentals/details/13506-Crennell-Ave_Cleveland_OH_44105_M49361-06223,4936106223,2970284232,AVAL,61122003,FOR_RENT,"Welcome to 13506 Crennell Avenue! Located in a quiet neighborhood, this cozy 2-bedroom, 2-bathroom home is ready for you to move in and make your own. Enjoy the convenience of being within walking distance of the neighborhood park. Pets are welcome too! There will be a $300 deposit required, as well as a $30 monthly fee for each pet. This 1040 sqft house is spacious and perfect for a family, or group of friends. It features an inviting living room and a kitchen that is great for your best dishes. The bedrooms are bright and airy with great storage space. Take advantage of this fantastic opportunity to live in a wonderful property that has a solid foundation. You won't be disappointed! Make 13506 Crennell Avenue your next home today, and experience the peace you desire. Date Available: Aug 5th 2024. $1, 450/month rent. $1, 450 security deposit required. Please submit the form on this page or contact Daniel Christian to learn more.",SINGLE_FAMILY,13506 Crennell Ave,13506 Crennell Ave,,Cleveland,OH,44105,2.0,2.0,,1040.0,,64,1400.0,2024-08-01,34101.0,14920.0,57000.0,False,,1.0,41.449633,-81.588186,Corlett,Cuyahoga,39035.0,,,,"Cleveland Metropolitan School District, Chapelside Cleveland Academy School District",3.9158037458710564,16.153846153846153
323,https://www.realtor.com/rentals/details/3231-W-112th-St_Cleveland_OH_44111_M48631-57696,4863157696,2970279349,NEOH,5058827,FOR_RENT,"3231 W 112TH ST | UP, Cleveland - Spacious 2 bed 1 bath multi-family home! $ 900 rent / $ 900 deposit $49 application fee per adult 1-2 pets OK with approved PetScreening and PetFee.(Some breed restrictions apply per HUD guidelines). NO SMOKING 1 time $129 non-refundable set up fee paid at lease signing $30/month required resident benefit package; can include personal property/liability insurance for an additional $5/month for $35/month total. All applicants are required to fill out a PetScreening application, found on our website directly on the application before being processed. Even if you have NO pets - this application must be filled out. One time, non-refundable pet fee of $200-500 per animal applies to all pets & must be paid prior to or when you pay your first month rent. (No fee for qualified assistance animals). Our application is processed through secure site: Findigs, and they require ID and income verification. Without this, your application will not be processed. They offer 24/7 chat support on their application directly if you have any questions. BEDROOMS: 2 BATHROOMS: 1 APPLIANCES PROVIDED: Fridge, stove, and microwave UTILITIES / RESIDENT RESPONSIBILITY: Resident pays gas and electric and is responsible for snow removal. Serious inquiries only.",MULTI_FAMILY,3231 W 112th St Unit 2 /Up,3231 W 112th St,Unit 2 /Up,Cleveland,OH,44111,2.0,1.0,,912.0,1916.0,64,900.0,2024-08-01,82500.0,28880.0,151000.0,False,,1.0,41.464385,-81.764437,Cudell,Cuyahoga,39035.0,2.0,0.0,,"Cleveland Metropolitan School District, Constellation Schools: Outreach Academy For Students With Di",8.55318262572963,11.842105263157896
326,https://www.realtor.com/rentals/details/2226-E-101st-St_Cleveland_OH_44106_M49235-42524,4923542524,2970262228,NEOH,5057602,FOR_RENT,"Welcome to this charming, fully renovated 3-bedroom Colonial, ideally situated in a prime downtown location just steps from Cleveland Clinic Main Campus and Meijer Fairfax Market. This beautifully updated home exudes modern elegance with its new flooring, fresh paint, and contemporary lighting throughout. Step into an inviting open layout featuring a spacious living and dining area, perfect for entertaining and daily living. The chef's kitchen is a highlight, showcasing sleek granite countertops, crisp white cabinets, and stylish black fixtures that blend form and function seamlessly. Convenience is key with a first-floor laundry and a well-placed half bath. Upstairs, you'll find three generously sized bedrooms, and a modern full bathroom, offering comfort and privacy. Finished third level for extra living space or rec room. Dont miss this opportunity to rent a beautifully renovated home in a vibrant and sought-after location.",SINGLE_FAMILY,2226 E 101st St,2226 E 101st St,,Cleveland,OH,44106,3.0,1.0,1.0,1424.0,1920.0,64,2500.0,2024-08-01,15500.0,8340.0,247000.0,False,3450.0,2.0,41.497456,-81.617531,Fairfax,Cuyahoga,39035.0,,0.0,,"Cleveland Metropolitan School District, Citizens Leadership Academy",0.6689558717808634,21.06741573033708
328,https://www.realtor.com/rentals/details/15907-Huntmere-Ave-Up_Cleveland_OH_44110_M95670-85072,9567085072,2970217439,AVAL,61147258,FOR_RENT,"Amazing 3 bedroom, 1 bathroom apartment in Cleveland Waterloo Arts District. Amenities included: front and back balcony, stainless steel appliances, updated kitchen, updated bathroom, and vinyl flooring throughout. 3rd floor includes a bedroom and a separate living area that can be used as an office/family room. Utilities included: water/sewer. Is not pet friendly. Close to many art-making spaces, music stores, galleries, restaurants, shops, parks and much more nearby. A short drive to downtown Cleveland makes this the perfect location. Date Available: Aug 5th 2024. $1000/month rent. $1000 security deposit required. All vouchers accepted. Please submit the form on this page or TEXT DNA Family Homes to learn more.",APARTMENT,15907 Huntmere Ave Unit Up,15907 Huntmere Ave,Unit Up,Cleveland,OH,44110,3.0,1.0,,1374.0,,65,1000.0,2024-07-31,,,,False,,1.0,41.574295,-81.569412,North Collinwood,Cuyahoga,39035.0,,,,Cleveland Metropolitan School District,5.236458322730142,8.733624454148472
329,https://www.realtor.com/rentals/details/1237-Washington-Ave-Apt-410_Cleveland_OH_44113_M47929-85772,4792985772,2970235341,REDI,-NlkbrqMdetvcLS0p01b$410,FOR_RENT,"To prequalify or apply, download the RentRedi app from Google Play or the App Store. You can also visit tenant.rentredi.com/getStarted/apply/PMN271 to apply, or go to tenant.rentredi.com/getStarted/prequalify/PMN271 to prequalify. For applying through the RentRedi mobile app, please follow these steps: Step 1. Tap the Apply button. Step 2. Click the + icon. Step 3. Select whether you're prequalifying or applying. Step 4. Enter in your unit code: PMN-271. Step 5. Click Enter Information and answer the questions. Step 6. Click Send to submit to the landlord. This property is using RentRedi for rent payments. With RentRedi, you can easily submit rent payments, boost your credit by reporting rent payments, sign up for affordable renters insurance, and more from the app!",CONDOS,1237 Washington Ave Apt 410,1237 Washington Ave,Apt 410,Cleveland,OH,44113,1.0,1.0,,704.0,,65,1375.0,2024-07-31,,,166000.0,False,,2.0,41.494287,-81.705038,Ohio City,Cuyahoga,39035.0,,,,"Cleveland Metropolitan School District, Near West Intergenerational School",5.061232199771075,23.4375
334,https://www.realtor.com/rentals/details/1982-Staunton-Rd_Cleveland_OH_44118_M37705-22188,3770522188,2970184257,NEOH,5058023,FOR_RENT,"Welcome to this spacious five bedroom two bathroom Tudor home in the heart of Cleveland Heights! The large living room has floor-to-ceiling bay windows and a beautiful fireplace. There is a dining room and a breakfast nook adjacent to the kitchen, which comes with appliances including dishwasher and plenty of cabinet space. First and second floors have hardwood flooring throughout. The second floor has three bedrooms, a full bathroom with a large bathtub, and a covered balcony porch, and the third floor has two carpeted bedrooms, and a full bathroom. There is also a private basement with plenty of extra storage and a washer/dryer, as well as a detached two car garage. Located close to University Circle, shopping, dining, and the Cleveland Clinic. Don't miss out, schedule a showing today!",MULTI_FAMILY,1982 Staunton Rd,1982 Staunton Rd,,Cleveland,OH,44118,5.0,2.0,,1750.0,1925.0,66,1750.0,2024-07-30,288400.0,47260.0,275700.0,False,7701.0,1.0,41.505663,-81.548231,,Cuyahoga,39035.0,,0.0,3.0,"Randall Park High School, Cleveland Heights-University Heights City, Old Brook High School School District, Apex Academy",3.1228725571650324,12.0
337,https://www.realtor.com/rentals/details/1900-Grove-Ct-Apt-407_Cleveland_OH_44113_M33656-89537,3365689537,2970178044,RNTR,9773376,FOR_RENT,Open and airy floor plan/one garage space and unlimited gated parking! This contemporary 2 bedroom 2/5 bath Grove Court (Duck Island) gem is waiting for you!!,CONDOS,1900 Grove Ct Apt 407,1900 Grove Ct,Apt 407,Cleveland,OH,44113,2.0,3.0,,2080.0,1985.0,66,2100.0,2024-07-30,240000.0,105430.0,382800.0,False,,1.0,41.487711,-81.697766,Ohio City,Cuyahoga,39035.0,,,,"Northeast Ohio College Preparatory School, Cleveland Metropolitan School District, Horizon Science Academy Denison Elementary School",4.776022384206025,12.115384615384615
