,property_url,property_id,listing_id,mls,mls_id,status,text,style,full_street_line,street,unit,city,state,zip_code,beds,full_baths,half_baths,sqft,year_built,days_on_mls,list_price,list_date,sold_price,assessed_value,estimated_value,new_construction,lot_sqft,price_per_sqft,latitude,longitude,neighborhoods,county,fips_code,stories,hoa_fee,parking_garage,nearby_schools,dist_to_cwru_mi,price_per_sqft_ann
59,https://www.realtor.com/rentals/details/3968-W-151st-St_Cleveland_OH_44111_M31955-03101,3195503101,2972887892,AMSR,a1p4u000003rrncAAA,FOR_RENT,,SINGLE_FAMILY,3968 W 151st St,3968 W 151st St,,Cleveland,OH,44111,3.0,1.0,,1155.0,,6,1610.0,2024-09-28,120000.0,39980.0,168000.0,False,,1.0,41.446867,-81.802964,"Kamm's Corners, West Park",Cuyahoga,39035.0,,35.0,,"Constellation Schools: Westpark Community Elementary, Cleveland Metropolitan School District, Constellation Schools: Westpark Community Middle",10.848170526097158,16.727272727272727
60,https://www.realtor.com/rentals/details/3443-W-94th-St_Cleveland_OH_44102_M32439-45677,3243945677,2972955336,RENU,r3772681,FOR_RENT,"AVAILABLE as soon as Sept 1. Don't miss out on your chance to live in this spacious home on a well kept street.HIGHLIGHTS OF THIS HOME:- A spacious living room with a fireplace.- A cozy traditional dining room with built in cabinets and a window seat.- Sunroom to the rear- Covered front porch- A/C unit in the dining room- LVP flooring throughout first floor- blinds throughout- Stove, fridge, dishwasher- Washer and dryer in basement- A full updated bathroom upstairs, and another in the basement- Glass block windows in basement- Newer furnace and hot water tank- 3 nicely sized bedrooms with hard wood floors.- One bedroom has a walkout.- The open attic is great for storage.- Fenced in yard- 2 car garage- Large basementCOMPLETED APPLICATIONS BEFORE VIEWINGBackground checks: $40 per applicantPet fees & rent apply for animals (ask for details)Move in with one month and security deposit.No section 8. No vouchers.No smoking.No evictions.No collections.Credit score 630, income 3x rent",SINGLE_FAMILY,3443 W 94th St,3443 W 94th St,,Cleveland,OH,44102,3.0,2.0,,1429.0,,4,1425.0,2024-09-30,74300.0,19390.0,117606.0,False,,1.0,41.45991,-81.747204,West Boulevard,Cuyahoga,39035.0,,,,"Cleveland Metropolitan School District, Constellation Schools: Outreach Academy For Students With Di",7.827763731513504,11.966410076976906
65,https://www.realtor.com/rentals/details/13725-Lakewood-Heights-Blvd-Apt-1_Cleveland_OH_44107_M48953-52289,4895352289,2972824994,AVAL,61194872,FOR_RENT,"Welcome to our beautiful 1-bedroom, 1-bathroom apartment located in the vibrant city of Cleveland, OH. This apartment is perfect for those seeking a cozy and convenient living space. With its prime location, you'll have easy access to all that Cleveland has to offer. The open floor plan allows for seamless flow between the living area and kitchen, making it ideal for entertaining guests or simply relaxing after a long day. Our on-site laundry facility ensures that you'll never have to worry about finding a laundromat again. Say goodbye to the hassle of lugging your laundry around and enjoy the convenience of doing it right at home. Parking will never be an issue with our on-site parking facility. You can rest easy knowing that your vehicle is safe and secure, just steps away from your front door. Located in a desirable neighborhood, you'll have easy access to a variety of shopping, dining, and entertainment options. Whether you're looking to explore the local art scene, enjoy a night out on the town, or simply unwind in one of the nearby parks, there's something for everyone just moments away. Don't miss out on this incredible opportunity! Call to schedule a showing and take advantage of our special offer of half off the first month's rent. Experience the convenience and comfort of this 1-bedroom apartment with hardwood floors and on-site laundry and parking. Your new home awaits you in Cleveland, OH. Call to schedule a showing! Apply Now at Renter insurance required paid up for one year",APARTMENT,13725 Lakewood Heights Blvd Apt 1,13725 Lakewood Heights Blvd,Apt 1,Cleveland,OH,44107,1.0,1.0,,825.0,,8,875.0,2024-09-26,,,,False,,1.0,41.470238,-81.787241,"West Park, Kamm's Corners",Cuyahoga,39035.0,,,,"Lakewood City Academy, Cleveland Metropolitan School District",9.573540026195435,12.727272727272727
68,https://www.realtor.com/rentals/details/3461-E-143rd-St-1_Cleveland_OH_44120_M93946-80291,9394680291,2972790739,RNTR,10032390,FOR_RENT,"3 bedroom duplex unit that has been newly renovated with new kitchen, bathroom, flooring and paint.",APARTMENT,3461 E 143rd St Unit 1,3461 E 143rd St,Unit 1,Cleveland,OH,44120,3.0,1.0,,1100.0,1900.0,8,1250.0,2024-09-26,,,,False,,1.0,41.465275,-81.582092,Mount Pleasant,Cuyahoga,39035.0,,,,Cleveland Metropolitan School District,3.0194461048107426,13.636363636363637
70,https://www.realtor.com/rentals/details/3853-W-137th-St_Cleveland_OH_44111_M35823-40031,3582340031,2972788385,AVAL,61194060,FOR_RENT,"Welcome to your next home! This charming 3-bedroom, 1-bathroom house, located on the west side of Cleveland near Cam's Corner, offers comfort, style, and convenience. The home features an updated kitchen and bathroom, perfect for modern living, and a newer roof for peace of mind. The spacious, finished basement is ideal for a home office, recreation room, or extra storage. Outside, you'll love the fenced backyard, perfect for pets or outdoor gatherings. The property sits on a lovely corner lot with great curb appeal and includes a two-car garage. Situated in a friendly neighborhood, this home is close to shopping, dining, and parks, providing everything you need within a short distance. Features Include: 3 Bedrooms, 1 Bathroom Updated kitchen with modern appliances Updated bathroom Finished basement for extra living space Fenced backyard Two-car garage Corner lot with great curb appeal Conveniently located near Cam's Corner Don't miss out on this fantastic rental opportunity! Contact us today to schedule a viewing.",SINGLE_FAMILY,3853 W 137th St,3853 W 137th St,,Cleveland,OH,44111,3.0,1.0,,1300.0,,8,1500.0,2024-09-26,83000.0,28430.0,194536.0,False,,1.0,41.449485,-81.786459,"Jefferson, West Park",Cuyahoga,39035.0,,,,Cleveland Metropolitan School District,9.98562631844224,13.846153846153847
77,https://www.realtor.com/rentals/details/12712-Firsby-Ave_Cleveland_OH_44135_M38441-92769,3844192769,2972828875,RTEC,59590755,FOR_RENT,"Welcome to your new home! This charming 924 square foot house, built in 1961, offers a cozy and inviting space for you to make your own. With 3 bedrooms and 1 bathroom, there is plenty of room for you to relax and unwind. The garage provides convenient storage for your vehicle or outdoor equipment, while the washer dryer hookups make laundry day a breeze. This property is a smoke-free environment, ensuring a clean and healthy living space for you to enjoy. Rental assistance is welcome, making it easy for you to secure this affordable and accommodating home. Whether you are looking for a quiet retreat or a convenient location close to amenities, this house has everything you need to feel comfortable and at ease. Don't miss out on the opportunity to make this house your own. With its convenient location, ample storage space, and welcoming atmosphere, this property is the perfect place for you to call home. Contact us today to schedule a viewing and see for yourself all that this lovely house has to offer.",SINGLE_FAMILY,12712 Firsby Ave,12712 Firsby Ave,,Cleveland,OH,44135,3.0,1.0,,924.0,,8,1450.0,2024-09-26,29900.0,10640.0,88000.0,False,,2.0,41.437975,-81.77741,"Puritas - Longmead, West Park",Cuyahoga,39035.0,,,,Cleveland Metropolitan School District,9.894799697810948,18.83116883116883
79,https://www.realtor.com/rentals/details/7311-Deveny-Ave_Cleveland_OH_44105_M33589-99643,3358999643,2973015485,NEOH,5074046,FOR_RENT,"7311 Deveny Ave, Cleveland - Spacious 2 bed 2 bath single family home! // $ 1000 rent / $ 1000 deposit // $49 application fee per adult // 1-2 pets OK in this unit. After application pre-approval, a PetScreening is required for any animals to proceed with one of our properties; a PetScreening affidavit is still required if you have no pets. (Some breed restrictions apply per HUD guidelines). // NO SMOKING // 1 time $149 non-refundable set up fee paid at lease signing // $30/month required resident benefit package; can include personal property/liability insurance for an additional $5/month for $35/month total // After application Pre-Approval 1 applicant per household application is required to fill out a PetScreening application, before being about to proceed with placing a Reservation Fee for one of our properties. You will receive a pre-approval for your application and in order to proceed, the PetScreening is required. Even if you have NO pets - this application must be filled out. One time, non-refundable pet fee of $200-500 per animal applies to all pets & must be paid before or when you pay your first month rent. (No fee for qualified assistance animals). // Our application is processed through secure site: Findigs, and they require ID and income verification. Without this, your application will not be processed. They offer 24/7 chat support on their application directly if you have any questions. // BEDROOMS: 2 // BATHROOMS: 2 // APPLIANCES PROVIDED: Fridge and stove // UTILITIES / RESIDENT RESPONSIBILITY: Residents are responsible for all utilities including: water/sewer/trash, gas & electric and are responsible to maintain lawn care, maintenance & snow removal //. Serious inquiries only.",SINGLE_FAMILY,7311 Deveny Ave,7311 Deveny Ave,,Cleveland,OH,44105,2.0,2.0,,1560.0,1890.0,4,1000.0,2024-09-30,70000.0,10500.0,70000.0,False,5271.0,1.0,41.440777,-81.636527,"South Broadway, Broadway Slavic Village",Cuyahoga,39035.0,2.0,0.0,1.0,"Cleveland Metropolitan School District, Hope Academy Northcoast",4.620509755346226,7.6923076923076925
80,https://www.realtor.com/rentals/details/635-W-Lakeside-Ave-Apt-100_Cleveland_OH_44113_M93262-43847,9326243847,2972599964,TRBO,1260828,FOR_RENT,"Welcome to Your Luxurious New Home! Experience upscale living at 635 West Lakeside Ave in Cleveland, OH! This exquisite, fully remodeled apartment is located in the sought-after Warehouse District. A rare find that won't last long. Step into this stunning 2-bedroom, 2-bathroom residence, where modern elegance meets comfort. Enjoy high-end finishes, upgraded appliances, a MASSIVE walk-in closet, and access to an on-site fitness center, are all designed to elevate your lifestyle. The beautiful hardwood floors and soaring vaulted ceilings create an airy, sophisticated atmosphere in every room. Feel secure in this well-appointed building, and rest easy knowing that pets are welcome! Rent includes electricity, garbage, sewage, and water. Don't miss your chance to indulge in this incredible opportunityschedule a private viewing today! To apply, visit TurboTenant and search for Property ID 1260828",APARTMENT,635 W Lakeside A Ave Unit 100,635 W Lakeside A Ave,Unit 100,Cleveland,OH,44113,2.0,2.0,,2115.0,,10,3500.0,2024-09-24,320000.0,26250.0,451500.0,False,,2.0,41.50037,-81.700252,"Warehouse District, Downtown Cleveland",Cuyahoga,39035.0,,,,"Cleveland Metropolitan School District, Horizon Science Academy Denison Elementary School, Near West Intergenerational School",4.773016376910219,19.858156028368793
82,https://www.realtor.com/rentals/details/18809-Bella-Dr-Apt-5_Cleveland_OH_44119_M40013-98184,4001398184,2972596960,NEOH,5072704,FOR_RENT,"18809 Bella Dr Unit 5, Cleveland - Spacious 2 bed 1 bath apartment! // $ 950 rent / $ 950 deposit // $49 application fee per adult // 1-2 pets OK with approved PetScreening and PetFee.(Some breed restrictions apply per HUD guidelines). // NO SMOKING // 1 time $129 non-refundable set up fee paid at lease signing // $30/month required resident benefit package; can include personal property/liability insurance for an additional $5/month for $35/month total. // CMHA OK - 2 bdrm voucher; must be prepared with reservation fee to hold the property and moving packet. // All applicants are required to fill out a PetScreening application, found on our website directly on the application before being processed. Even if you have NO pets - this application must be filled out. One time, non-refundable pet fee of $200-500 per animal applies to all pets & must be paid prior to or when you pay your first month rent. (No fee for qualified assistance animals). // Our application is processed through secure site: Findigs, and they require ID and income verification. Without this, your application will not be processed. They offer 24/7 chat support on their application directly if you have any questions. // BEDROOMS: 2 // BATHROOMS: 1 // APPLIANCES PROVIDED: Microwave New fridge & stove will be provided upon tenancy // UTILITIES / RESIDENT RESPONSIBILITY: Residents are responsible for gas & electric and are responsible for snow removal. // Serious inquiries only.",APARTMENT,18809 Bella Dr Apt 5,18809 Bella Dr,Apt 5,Cleveland,OH,44119,2.0,1.0,,768.0,1965.0,10,950.0,2024-09-24,150000.0,52510.0,251611.0,False,,1.0,41.581265,-81.54712,North Collinwood,Cuyahoga,39035.0,3.0,,,"Bella Academy Of Excellence, Lakeshore Intergenerational School, Cleveland Metropolitan School District, New Day Academy Boarding & Day School",6.189278980597772,14.84375
84,https://www.realtor.com/rentals/details/1464-W-75th-St_Cleveland_OH_44102_M40183-01514,4018301514,2972590908,NEOH,5069322,FOR_RENT,"Available for rent NOW in the heart of Gordon Square! This charming colonial is nestled in the heart of the Detroit Shoreway Neighborhood, offering both comfort and convenience. The property features a recently updated kitchen, perfect for culinary enthusiasts, and a spacious first-floor open layout ideal for entertaining guests. Upstairs, you'll find three generously sized bedrooms, providing ample space for family and guests. The third floor offers a large fourth bedroom or recreation room, allowing you to create the space of your dreams. You can rest easy knowing a new premium roof and gutter system was installed in 2023, adding to your peace of mind. The neighborhood is a true gem, just a short walk from the vibrant shops and dining of Gordon Square. Nature lovers will enjoy the nearby Metroparks and serene Edgewater Beach. For those who love exploring the city, trendy areas like Hingetown, Ohio City, Tremont, and Downtown are only a short drive away. Dont miss the opportunity to make 1464 West 75th your new home. Schedule a showing today!",SINGLE_FAMILY,1464 W 75th St,1464 W 75th St,,Cleveland,OH,44102,4.0,1.0,,2152.0,1910.0,10,2000.0,2024-09-24,222000.0,19850.0,243000.0,False,1729.0,1.0,41.480536,-81.736917,Detroit - Shoreway,Cuyahoga,39035.0,3.0,0.0,,Cleveland Metropolitan School District,6.86721242049206,11.152416356877323
86,https://www.realtor.com/rentals/details/13805-Othello-Ave-Unit-Downstairs_Cleveland_OH_44110_M95619-59809,9561959809,2972553063,REDI,-O3T6gvpNrWfh6UzycbL$Downstairs,FOR_RENT,"To prequalify or apply, download the RentRedi app from Google Play or the App Store. You can also visit tenant.rentredi.com/getStarted/apply/CPI316 to apply, or go to tenant.rentredi.com/getStarted/prequalify/CPI316 to prequalify. For applying through the RentRedi mobile app, please follow these steps: Step 1. Tap the Apply button. Step 2. Click the + icon. Step 3. Select whether you're prequalifying or applying. Step 4. Enter in your unit code: CPI-316. Step 5. Click Enter Information and answer the questions. Step 6. Click Send to submit to the landlord. This property is using RentRedi for rent payments. With RentRedi, you can easily submit rent payments, boost your credit by reporting rent payments, sign up for affordable renters insurance, and more from the app!",DUPLEX_TRIPLEX,13805 Othello Ave Unit Downstairs,13805 Othello Ave,Unit Downstairs,Cleveland,OH,44110,2.0,1.0,,1048.0,,10,1200.0,2024-09-24,,,,False,,1.0,41.566284,-81.586479,North Collinwood,Cuyahoga,39035.0,,,,Cleveland Metropolitan School District,4.426097494585799,13.740458015267176
88,https://www.realtor.com/rentals/details/3189-W-30th-St_Cleveland_OH_44109_M43125-68101,4312568101,2972549751,NEOH,5072427,FOR_RENT,"3189 W 30TH ST| DN , Cleveland - Spacious 3 bed 1 bath multi-family home! // $ 995 rent / $ 995 deposit // $49 application fee per adult // 1-2 pets OK in this unit. After application pre-approval, a PetScreening is required for any animals to proceed with one of our properties; a PetScreening affidavit is still required if you have no pets. (Some breed restrictions apply per HUD guidelines). // NO SMOKING // 1 time $129 non-refundable set up fee paid at lease signing // $30/month required resident benefit package; can include personal property/liability insurance for an additional $5/month for $35/month total. // After application Pre-Approval 1 applicant per household application is required to fill out a PetScreening application, before being about to proceed with placing a Reservation Fee for one of our properties. You will receive a pre-approval for your application and in order to proceed, the PetScreening is required. Even if you have NO pets - this application must be filled out. One time, non-refundable pet fee of $200-500 per animal applies to all pets & must be paid before or when you pay your first month rent. (No fee for qualified assistance animals). // Our application is processed through secure site: Findigs, and they require ID and income verification. Without this, your application will not be processed. They offer 24/7 chat support on their application directly if you have any questions. // BEDROOMS: 3 // BATHROOMS: 1 // APPLIANCES PROVIDED : N/A // UTILITIES / RESIDENT RESPONSIBILITY: Resident pays gas and electric and is responsible for snow removal. // Serious inquiries only.",MULTI_FAMILY,3189 W 30th St Unit 1 /Dn,3189 W 30th St,Unit 1 /Dn,Cleveland,OH,44109,3.0,1.0,,1116.0,1900.0,11,995.0,2024-09-23,45259.0,14250.0,132120.0,False,,1.0,41.467345,-81.701372,Clark - Fulton,Cuyahoga,39035.0,2.0,0.0,1.0,Cleveland Metropolitan School District,5.457219522895712,10.698924731182796
90,https://www.realtor.com/rentals/details/2112-Hurley-Ave-1F_Cleveland_OH_44109_M91283-33142,9128333142,2972858736,RENU,r3771797,FOR_RENT,"For interested prospects, please provide a mobile number so we can easily get back to you with answers on your inquiry.LIMITED OFFER!!$500 OFF FOR THE FIRST MONTH'S RENT IF THE LEASE IS SIGNED BEFORE OCTOBER 31st!Welcome home to a 3 bedroom first floor apartment in Cleveland's Brooklyn Center neighborhood. Freshly painted and newer flooring throughout. Apartment boasts a spacious living room, 3 bedrooms, and a full bathroom. The kitchen with dining area is perfect for hosting family dinners or entertaining guests. Step inside and be greeted by the stunning hardwood floors and trim that add charm and character to the main floor. The unfinished basement has a laundry area.Washer and dryer are provided at no cost. Enjoy the convenience of an enclosed front porch. This well-maintained home also offers newer roof and siding, as well as a newer furnace and hot water heater. The fully fenced backyard is perfect for pets or children to play in. There is plenty of parking available with the double-wide driveway and off street. Located in close proximity to the Cleveland Metroparks Zoo, this home offers easy access to the Jennings Freeway and I-71. It is also within minutes of the MetroHealth Main Campus and Steelyard Commons.Pictures and amenity list are for marketing purposes only and represent our most recent assessment of the home. Renter is responsible for verifying contents and conditions prior to leasing. All properties have additional charges which may include an insurance component and benefits. These additional fees are based on location and benefit package.All Poplar residents are enrolled to the StreetCred program, a Resident Benefits Package (RBP) for $49.95/month which includes liability insurance, credit building to help boost the residents credit score with timely rent payments, up to $1M Identity Theft Protection, HVAC air filter delivery (for applicable properties), move-in concierge service making utility connection and home service setup a breeze during your move-in, our best-in-class resident rewards program, and much more! More details upon application.The Landlord requires Tenant to obtain liability coverage of at least $100, 000 in property damage and legal liability from an A-rated carrier and to maintain such coverage throughout the entire term of the lease agreement. Tenant is required to furnish Landlord evidence of the required insurance prior to occupancy, at the time of each lease renewal period, and upon request.To satisfy the insurance requirement, Tenant may either (1) be automatically enrolled into a policy that satisfies the coverage requirements as part of the Resident Benefits Package; or (2) obtain alternative liability coverage from an insurer of Tenants choice. If option (2) is selected and approved, the tenant will be enrolled in RBP for $39.00/month. The option Tenant chooses will not affect whether Tenants lease application is approved or the terms of Tenants Lease.",SINGLE_FAMILY,2112 Hurley Ave Unit 1F,2112 Hurley Ave,Unit 1F,Cleveland,OH,44109,3.0,1.0,,1000.0,,7,1500.0,2024-09-27,,,,False,,2.0,41.449593,-81.69735,Brooklyn - Centre,Cuyahoga,39035.0,,,,"Cleveland Metropolitan School District, Horizon Science Academy-Denison Middle School",5.963743689688604,18.0
91,https://www.realtor.com/rentals/details/1014-Fairfield-Ave-Down_Cleveland_OH_44113_M91848-82505,9184882505,2937544872,TRBO,400156,FOR_RENT,"This recently updated 2 bedroom 1 1/2 bathroom is available November 1st. It features OFF street parking, central air conditioning, updated bathrooms, and an updated kitchen with granite countertops. A washer and dryer are provided in the basement that also features plenty of storage. The apartment is located on the first floor. Please no pets. Applicants will apply through Turbo Tenant. The apartment is located down the street from Southside and Parallax. Please reply to this post or text/call Denise to schedule a showing. To apply, visit TurboTenant and search for Property ID 400156",CONDOS,1014 Fairfield Ave Unit Down,1014 Fairfield Ave,Unit Down,Cleveland,OH,44113,2.0,1.0,,1000.0,,11,1375.0,2024-09-23,,,,False,,1.0,41.48246,-81.688316,Tremont,Cuyahoga,39035.0,,,,"Northeast Ohio College Preparatory School, Cleveland Metropolitan School District",4.41205840196798,16.5
95,https://www.realtor.com/rentals/details/3189-W-30th-St_Cleveland_OH_44109_M43125-68101,4312568101,2972548253,NEOH,5072422,FOR_RENT,"3189 W 30TH ST| UP , Cleveland - Spacious 2 bed 1 bath multi-family home! // $ 900 rent / $ 900 deposit // $49 application fee per adult // 1-2 pets OK in this unit. After application pre-approval, a PetScreening is required for any animals to proceed with one of our properties; a PetScreening affidavit is still required if you have no pets. (Some breed restrictions apply per HUD guidelines). // NO SMOKING // 1 time $129 non-refundable set up fee paid at lease signing // $30/month required resident benefit package; can include personal property/liability insurance for an additional $5/month for $35/month total. // After application Pre-Approval 1 applicant per household application is required to fill out a PetScreening application, before being about to proceed with placing a Reservation Fee for one of our properties. You will receive a pre-approval for your application and in order to proceed, the PetScreening is required. Even if you have NO pets - this application must be filled out. One time, non-refundable pet fee of $200-500 per animal applies to all pets & must be paid before or when you pay your first month rent. (No fee for qualified assistance animals). // Our application is processed through secure site: Findigs, and they require ID and income verification. Without this, your application will not be processed. They offer 24/7 chat support on their application directly if you have any questions. // BEDROOMS: 2 // BATHROOMS: 1 // APPLIANCES PROVIDED : N/A // UTILITIES / RESIDENT RESPONSIBILITY: Resident pays gas and electric and is responsible for snow removal. // Serious inquiries only.",MULTI_FAMILY,3189 W 30th St Unit 2 /Up,3189 W 30th St,Unit 2 /Up,Cleveland,OH,44109,2.0,1.0,,544.0,1900.0,11,900.0,2024-09-23,45259.0,14250.0,132120.0,False,,2.0,41.467345,-81.701372,Clark - Fulton,Cuyahoga,39035.0,2.0,0.0,1.0,Cleveland Metropolitan School District,5.457219522895712,19.852941176470587
